<?xml version="1.0" encoding="utf-8"?>
<!DOCTYPE mythuitheme SYSTEM "http://www.mythtv.org/schema/mythuitheme.dtd">
<mythuitheme>

    <window name="status">

        <textarea name="heading">
            <area>30,10,740,40</area>
            <font>baselarge</font>
            <value>System Status</value>
        </textarea>

        <shape name="list_background" from="basebackground">
            <area>30,94,1220,390</area>
        </shape>

        <buttonlist name="category">
            <area>70,44,1250,44</area>
            <layout>horizontal</layout>
            <spacing>6</spacing>
            <buttonarea>24,0,1220,44</buttonarea>
            <triggerevent context="Global" action="ESCAPE">UP</triggerevent>
            <statetype name="buttonitem">
                <state name="active">
                    <area>0,0,214,44</area>
                    <shape name="background" from="basewidgetshape" />
                    <textarea name="buttontext" from="basetextarea">
                        <area>4,2,206,40</area>
                        <font>basesmall</font>
                        <align>allcenter</align>
                    </textarea>
                </state>
                <state name="selectedactive" from="active">
                    <shape name="background" from="baseselectedwidgetshape" />
                </state>
                <state name="selectedinactive" from="active">
                    <textarea name="buttontext">
                        <font>basesmall</font>
                    </textarea>
                </state>
            </statetype>
            <statetype name="downscrollarrow">
                <position>1134,12</position>
                <state type="off">
                    <imagetype name="dnon">
                        <filename>lb-rtarrow-reg.png</filename>
                    </imagetype>
                </state>
                <state type="full">
                    <imagetype name="dnoff">
                        <filename>lb-rtarrow-sel.png</filename>
                    </imagetype>
                </state>
            </statetype>
            <statetype name="upscrollarrow">
                <position>-2,12</position>
                <state type="off">
                    <imagetype name="upon">
                        <filename>lb-ltarrow-reg.png</filename>
                    </imagetype>
                </state>
                <state type="full">
                    <imagetype name="upoff">
                        <filename>lb-ltarrow-sel.png</filename>
                    </imagetype>
                </state>
            </statetype>
        </buttonlist>

        <buttonlist name="log" from="basebuttonlist2">
            <position>18,108</position>
            <searchposition>-1,490</searchposition>
        </buttonlist>

        <textarea name="helplabel">
            <area>30,490,740,30</area>
            <value>Details</value>
            <font>basemedium</font>
        </textarea>

        <textarea name="helptext" from="basetextarea">
            <area>40,530,1200,150</area>
            <value>This screen displays the status of various system components</value>
            <multiline>yes</multiline>
        </textarea>

    </window>

</mythuitheme>

